{
  "id": "garrys-mod-nexus-mods-mod",
  "name": "盖瑞模组 Nexus Mods 专区",
  "nameEn": "Garry's Mod on Nexus Mods",
  "type": "mod",
  "siteId": "nexus-mods",
  "gameId": "garrys-mod",
  "url": "https://www.nexusmods.com/garrysmod",
  "note": "Nexus 上的 MOD 专区，共 47 个 MOD",
  "noteEn": "Nexus Mods hub with 47 mods",
  "linkHealth": "ok",
  "checkedAt": "2026-10-29",
  "publishStatus": "published",
  "reviewStatus": "unverified"
}
