{
  "id": "counter-strike-source-pcgamingwiki-guide-page",
  "name": "反恐精英：起源 技术资料页",
  "nameEn": "Counter-Strike: Source on PCGamingWiki",
  "type": "guide-page",
  "siteId": "pcgamingwiki",
  "gameId": "counter-strike-source",
  "url": "https://www.pcgamingwiki.com/wiki/Counter-Strike%3A_Source",
  "note": "存档与配置位置、画面设置、已知问题修复",
  "noteEn": "Save/config paths, display settings, and bug fixes",
  "linkHealth": "ok",
  "checkedAt": "2026-10-29",
  "publishStatus": "published",
  "reviewStatus": "unverified"
}
