{
  "id": "satisfactory-pcgamingwiki-guide-page",
  "name": "幸福工厂 技术资料页",
  "nameEn": "Satisfactory on PCGamingWiki",
  "type": "guide-page",
  "siteId": "pcgamingwiki",
  "gameId": "satisfactory",
  "url": "https://www.pcgamingwiki.com/wiki/Satisfactory",
  "note": "存档与配置位置、画面设置、已知问题修复",
  "noteEn": "Save/config paths, display settings, and bug fixes",
  "linkHealth": "ok",
  "checkedAt": "2026-10-29",
  "publishStatus": "published",
  "reviewStatus": "unverified"
}
