{
  "id": "ark-survival-evolved-pcgamingwiki-guide-page",
  "name": "方舟：生存进化 技术资料页",
  "nameEn": "ARK: Survival Evolved on PCGamingWiki",
  "type": "guide-page",
  "siteId": "pcgamingwiki",
  "gameId": "ark-survival-evolved",
  "url": "https://www.pcgamingwiki.com/wiki/ARK%3A_Survival_Evolved",
  "note": "存档与配置位置、画面设置、已知问题修复",
  "noteEn": "Save/config paths, display settings, and bug fixes",
  "linkHealth": "ok",
  "checkedAt": "2026-10-29",
  "publishStatus": "published",
  "reviewStatus": "unverified"
}
