{
  "id": "overwatch-pcgamingwiki-guide-page",
  "name": "守望先锋 技术资料页",
  "nameEn": "Overwatch on PCGamingWiki",
  "type": "guide-page",
  "siteId": "pcgamingwiki",
  "gameId": "overwatch",
  "url": "https://www.pcgamingwiki.com/wiki/Overwatch_2",
  "note": "存档与配置位置、画面设置、已知问题修复",
  "noteEn": "Save/config paths, display settings, and bug fixes",
  "linkHealth": "ok",
  "checkedAt": "2026-10-29",
  "publishStatus": "published",
  "reviewStatus": "unverified"
}
