{
  "id": "pcgw-palworld",
  "name": "幻兽帕鲁 技术资料页",
  "type": "guide-page",
  "siteId": "pcgamingwiki",
  "gameId": "palworld",
  "url": "https://www.pcgamingwiki.com/api/appid.php?appid=1623730",
  "note": "存档与配置位置、画面设置、已知问题修复",
  "linkHealth": "ok",
  "checkedAt": "2026-10-24",
  "publishStatus": "published"
}
