{
  "id": "monster-hunter-wilds-pcgamingwiki-guide-page",
  "name": "怪物猎人 荒野 技术资料页",
  "nameEn": "Monster Hunter Wilds on PCGamingWiki",
  "type": "guide-page",
  "siteId": "pcgamingwiki",
  "gameId": "monster-hunter-wilds",
  "url": "https://www.pcgamingwiki.com/wiki/Monster_Hunter_Wilds",
  "note": "存档与配置位置、画面设置、已知问题修复",
  "noteEn": "Save/config paths, display settings, and bug fixes",
  "linkHealth": "ok",
  "checkedAt": "2026-10-29",
  "publishStatus": "published",
  "reviewStatus": "unverified"
}
