{
  "id": "team-fortress-2-steamdb-other",
  "name": "军团要塞 2 价格与版本史",
  "nameEn": "Team Fortress 2 on SteamDB",
  "type": "other",
  "siteId": "steamdb",
  "gameId": "team-fortress-2",
  "url": "https://steamdb.info/app/440/",
  "note": "史低价格、更新补丁记录、在线人数",
  "noteEn": "All-time low price, update history, and player counts",
  "linkHealth": "ok",
  "checkedAt": "2026-10-29",
  "publishStatus": "published",
  "reviewStatus": "unverified"
}
