{
  "id": "protondb-elden-ring",
  "name": "艾尔登法环 Linux / Steam Deck 兼容报告",
  "type": "other",
  "siteId": "protondb",
  "gameId": "elden-ring",
  "url": "https://www.protondb.com/app/1245620",
  "note": "社区运行评级与启动参数",
  "linkHealth": "ok",
  "checkedAt": "2026-10-24",
  "publishStatus": "published"
}
