{
  "id": "grand-theft-auto-v-legacy-steamdb-other",
  "name": "Grand Theft Auto V 传承版 价格与版本史",
  "nameEn": "Grand Theft Auto V Legacy on SteamDB",
  "type": "other",
  "siteId": "steamdb",
  "gameId": "grand-theft-auto-v-legacy",
  "url": "https://steamdb.info/app/271590/",
  "note": "史低价格、更新补丁记录、在线人数",
  "noteEn": "All-time low price, update history, and player counts",
  "linkHealth": "ok",
  "checkedAt": "2026-10-29",
  "publishStatus": "published",
  "reviewStatus": "unverified"
}
