{
  "id": "among-us-pcgamingwiki-guide-page",
  "name": "太空狼人杀（Among Us） 技术资料页",
  "nameEn": "Among Us on PCGamingWiki",
  "type": "guide-page",
  "siteId": "pcgamingwiki",
  "gameId": "among-us",
  "url": "https://www.pcgamingwiki.com/wiki/Among_Us",
  "note": "存档与配置位置、画面设置、已知问题修复",
  "noteEn": "Save/config paths, display settings, and bug fixes",
  "linkHealth": "ok",
  "checkedAt": "2026-10-29",
  "publishStatus": "published",
  "reviewStatus": "unverified"
}
