{
  "id": "mount-blade-ii-bannerlord-steamdb-other",
  "name": "骑马与砍杀 2：霸主 价格与版本史",
  "nameEn": "Mount & Blade II: Bannerlord on SteamDB",
  "type": "other",
  "siteId": "steamdb",
  "gameId": "mount-blade-ii-bannerlord",
  "url": "https://steamdb.info/app/261550/",
  "note": "史低价格、更新补丁记录、在线人数",
  "noteEn": "All-time low price, update history, and player counts",
  "linkHealth": "ok",
  "checkedAt": "2026-10-29",
  "publishStatus": "published",
  "reviewStatus": "unverified"
}
