{
  "id": "euro-truck-simulator-2-steam-mod",
  "name": "欧洲卡车模拟 2 创意工坊",
  "nameEn": "Euro Truck Simulator 2 Steam Workshop",
  "type": "mod",
  "siteId": "steam",
  "gameId": "euro-truck-simulator-2",
  "url": "https://steamcommunity.com/app/227300/workshop/",
  "note": "Steam 内一键订阅，自动更新",
  "noteEn": "One-click subscribe and auto-update in Steam",
  "linkHealth": "ok",
  "checkedAt": "2026-10-29",
  "publishStatus": "published",
  "reviewStatus": "unverified"
}
