{
  "id": "dayz-steam-mod",
  "name": "DayZ 创意工坊",
  "nameEn": "DayZ Steam Workshop",
  "type": "mod",
  "siteId": "steam",
  "gameId": "dayz",
  "url": "https://steamcommunity.com/app/221100/workshop/",
  "note": "Steam 内一键订阅，自动更新",
  "noteEn": "One-click subscribe and auto-update in Steam",
  "linkHealth": "ok",
  "checkedAt": "2026-10-29",
  "publishStatus": "published",
  "reviewStatus": "unverified"
}
