{
  "id": "call-of-duty-modern-warfare-ii-steamdb-other",
  "name": "使命召唤 价格与版本史",
  "nameEn": "Call of Duty on SteamDB",
  "type": "other",
  "siteId": "steamdb",
  "gameId": "call-of-duty-modern-warfare-ii",
  "url": "https://steamdb.info/app/1938090/",
  "note": "史低价格、更新补丁记录、在线人数",
  "noteEn": "All-time low price, update history, and player counts",
  "linkHealth": "ok",
  "checkedAt": "2026-10-29",
  "publishStatus": "published",
  "reviewStatus": "unverified"
}
