{
  "id": "yu-gi-oh-master-duel-nexus-mods-mod",
  "name": "游戏王 大师决斗 Nexus Mods 专区",
  "nameEn": "Yu-Gi-Oh! Master Duel on Nexus Mods",
  "type": "mod",
  "siteId": "nexus-mods",
  "gameId": "yu-gi-oh-master-duel",
  "url": "https://www.nexusmods.com/yugiohmasterduel",
  "note": "Nexus 上的 MOD 专区，共 1,266 个 MOD",
  "noteEn": "Nexus Mods hub with 1,266 mods",
  "linkHealth": "ok",
  "checkedAt": "2026-10-29",
  "publishStatus": "published",
  "reviewStatus": "unverified"
}
