{
  "id": "trove-steamdb-other",
  "name": "宝藏世界 价格与版本史",
  "nameEn": "Trove on SteamDB",
  "type": "other",
  "siteId": "steamdb",
  "gameId": "trove",
  "url": "https://steamdb.info/app/304050/",
  "note": "史低价格、更新补丁记录、在线人数",
  "noteEn": "All-time low price, update history, and player counts",
  "linkHealth": "ok",
  "checkedAt": "2026-10-29",
  "publishStatus": "published",
  "reviewStatus": "unverified"
}
