{
  "id": "warhammer-40-000-rogue-trader-pcgamingwiki-guide-page",
  "name": "Warhammer 40,000: 行商浪人 技术资料页",
  "nameEn": "Warhammer 40,000: Rogue Trader on PCGamingWiki",
  "type": "guide-page",
  "siteId": "pcgamingwiki",
  "gameId": "warhammer-40-000-rogue-trader",
  "url": "https://www.pcgamingwiki.com/wiki/Warhammer_40%2C000%3A_Rogue_Trader",
  "note": "存档与配置位置、画面设置、已知问题修复",
  "noteEn": "Save/config paths, display settings, and bug fixes",
  "linkHealth": "ok",
  "checkedAt": "2026-10-29",
  "publishStatus": "published",
  "reviewStatus": "unverified"
}
