{
  "id": "workshop-cities-skylines",
  "name": "城市：天际线 创意工坊",
  "type": "mod",
  "siteId": "steam",
  "gameId": "cities-skylines",
  "url": "https://steamcommunity.com/app/255710/workshop/",
  "note": "Steam 内一键订阅，自动更新",
  "linkHealth": "ok",
  "checkedAt": "2026-10-24",
  "publishStatus": "published"
}
