{
  "id": "tom-clancys-rainbow-six-siege-steamdb-other",
  "name": "彩虹六号：围攻 价格与版本史",
  "nameEn": "Tom Clancy's Rainbow Six Siege on SteamDB",
  "type": "other",
  "siteId": "steamdb",
  "gameId": "tom-clancys-rainbow-six-siege",
  "url": "https://steamdb.info/app/359550/",
  "note": "史低价格、更新补丁记录、在线人数",
  "noteEn": "All-time low price, update history, and player counts",
  "linkHealth": "ok",
  "checkedAt": "2026-10-29",
  "publishStatus": "published",
  "reviewStatus": "unverified"
}
